,text_id,text,positive,negative,neutral,label
0,paragraph.1,"CLARIFICATION: Sonny Hashmi, the Federal Acquisition Service Commissioner, did not take part in the March 20 meeting with the TMF Board as previously reported. GSA also says it alerted the TMF Board in February 2022 and has been regularly briefing them on its progress. The story has been updated to reflect these changes.",0.8661192059516907,0.02192726545035839,0.11195347458124161,positive
1,paragraph.2, ,0.17821143567562103,0.1738315224647522,0.6479570269584656,neutral
2,paragraph.3,The General Services Administration is facing a crisis of confidence.,0.14179810881614685,0.844947874546051,0.013253970071673393,negative
3,paragraph.4,"The third scathing inspector general report since 2016 once again reinforced how headquarters can’t make the Technology Transformation Service play by the government’s rules, in turn leading agency chief information officers and other technology executives to question whether GSA, as a whole, can be trusted.",0.18856805562973022,0.7965527176856995,0.014879192225635052,negative
4,paragraph.5,        Join us Apr. 25 at 1 p.m. EST for Federal News Network's StateRAMP Exchange where we'll explore how the StateRAMP program provides cyber assurances as state agencies continue their IT modernization journies. | Register today!,0.9782677888870239,0.00873603019863367,0.012996231205761433,positive
5,paragraph.6,"Interviews with five current federal technology executives, three former technology leaders and industry experts say the trust between TTS, and in some ways GSA, has, unfortunately, once again been broken.",0.360633909702301,0.6018730401992798,0.03749307245016098,negative
6,paragraph.7,"“TTS sells you snake oil and then leaves,” said one agency CIO, who like others for this story, requested anonymity in order to speak candidly about their work with GSA and TTS. “My team must clean up TTS’ mess, and programs are more upset because they didn’t get what they thought they were promised.”",0.10443639010190964,0.895548403263092,0.000015226402865664568,negative
7,paragraph.8,"Other technology executives echoed these comments, saying they either don’t trust TTS to come into their agency, or if they do, only in certain circumstances when they can wrap oversight and accountability from their own staff around them.",0.9041892886161804,0.009569657035171986,0.08624109625816345,positive
8,paragraph.9,"“If you talk to any CIO, they will tell you they will not welcome having TTS interject themselves into their enterprise. It’s an attitude. It’s like ‘we are here; we are the cool kids and you have screwed things up for years, so now we will fix it.’  But they don’t understand the long-term challenges and needs of the agency,” said another CIO.",0.9823423027992249,0.017652926966547966,0.0000047510507101833355,positive
9,paragraph.10,"Another federal technology executive added, “They come in to solve one problem, and they create two different problems. They are not systems experts. The culture of the organization doesn’t focus on fixing the business processes and the technology. They are very much go in and take a quick hit.”",0.27361080050468445,0.7251750230789185,0.0012141343904659152,negative
10,paragraph.11,Failed attempt to change TTS,0.23162686824798584,0.13385099172592163,0.6345220804214478,neutral
11,paragraph.12,"While many technology executives said they weren’t surprised by the IG’s findings that TTS misled agencies for four years about how Login.gov met certain identity proofing requirements under the National Institute of Standards and Technology Special Publication 800-63-3, the IG report signals TTS remains a horse that cannot be broken, despite multiple attempts across multiple administrations.",0.9984065890312195,0.0015270913718268275,0.00006632281292695552,positive
12,paragraph.13,"“TTS was encouraged to be risk-takers and innovative, but they never realized that they are still federal employees, and there are rules and there is a bureaucracy, which isn’t always bad. It’s a way to make sure you are coloring in the lines,” said a former federal executive familiar with GSA. “I think most people like the idea of TTS, bringing in innovative acquisition approaches and encouraging folks to come in and out of government. But maybe there needs to be an education course for all new employees about the rules of the road in government. Or maybe they need to be a hybrid organization that lets people that come in and out, but also has permanent staff to make sure rules are being followed.”",0.9310891032218933,0.06891094148159027,2.2997511450739694e-8,positive
13,paragraph.14,"In fact, sources say during the final days of the Trump administration, GSA leadership seriously considered moving the TTS director, a deputy commissioner of the Federal Acquisition Service, down a notch to an assistant commissioner role, in part because of the organization’s refusal to follow federal acquisition and management principles.",0.9804332256317139,0.018615983426570892,0.0009507606155239046,positive
14,paragraph.15,        Read more: Reporter's Notebook,0.19871068000793457,0.1064688116312027,0.6948204636573792,neutral
15,paragraph.16,"“GSA did think about how to restructure TTS management. It’s unusual to have two deputy commissioners, and organizationally, it would be better to have TTS at [the] same level as other assistant commissioners in FAS,” said one former federal official, familiar with GSA’s considerations. “GSA was in touch with transition officials and floated that management change, and the Biden transition declined to agree with us. It was a way of setting expectations that they are part of the team and were held to the same expectations and all rules around financial, legal and acquisition.”",0.7193834781646729,0.28061649203300476,1.534299443051168e-8,positive
16,paragraph.17,"The concern about TTS from the beginning was, in making the leader a deputy commissioner, it gave them a higher profile with internal and external folks, especially given the size and impact of the organization, which pales in comparison to several of GSA’s other business lines, like technology and professional services.",0.9923633337020874,0.0035679317079484463,0.0040687257423996925,positive
17,paragraph.18,Reminiscent of ‘parking’ money scandal,0.3028244972229004,0.15070413053035736,0.5464714169502258,neutral
18,paragraph.19,"This latest incident brings back bad memories of GSA’s troubles in the 2000s. And as the old adage says, “those who don’t learn from history are doomed to repeat it.”",0.009827828034758568,0.9567515254020691,0.03342067077755928,negative
19,paragraph.20,"It now seems like GSA’s crisis of confidence across many agencies has returned it to the days of its “parking” money scandal in the early 2000s. During that episode, GSA offered the Defense Department and other agencies the ability to improperly extend expiring funds by “parking” the money in assistant acquisition accounts.",0.37344273924827576,0.6265561580657959,0.000001123784386436455,negative
20,paragraph.21,"Former federal executives said it took GSA several years to rebuild the trust from that incident, and after four years of deceit around the Login.gov platform that not only involves TTS, but the agency’s well-respected CIO, Dave Shive, it’s going to take more than a few promises and well-worn talking points to rebuild the trust.",0.9917058944702148,0.007873963564634323,0.0004201940610073507,positive
21,paragraph.22,"“GSA got very serious about repairing that trust in the 2000s. Assisted Acquisition Services was a huge business line for them. It went from $7 billion down to $3 billion a year. Now it’s up to more than $15 billion. But it grew in way that is more structured, there is more training and more control around it,” said a former federal executive familiar with GSA and TTS. “It will take a lot of repairs to fix trust issues at TTS and to get TTS to work for agencies again. If GSA is serious about keeping this organization and getting people to understand their value and reestablish some trust, this will take some effort. It is not just briefing people and replacing people, but a long-term effort.”",0.9980491399765015,0.0019506992539390922,6.136701102832376e-8,positive
22,paragraph.23,"For GSA, those long-term efforts started on March 20, by meeting with the Technology Modernization Fund Board, and continues Wednesday during a hearing before the House Oversight and Accountability Committee’s Subcommittee on Government Operations and the Federal Workforce.",0.6700214147567749,0.21737028658390045,0.11260829865932465,positive
23,paragraph.24,        Sign up for our daily newsletter so you never miss a beat on all things federal,0.12789088487625122,0.11895080655813217,0.7531583309173584,neutral
24,paragraph.25,TMF Board unhappy,0.10441097617149353,0.40917325019836426,0.4864157736301422,neutral
25,paragraph.26,"Government sources say GSA started its apology tour when Sonny Hashmi, the commissioner of the Federal Acquisition Service, where TTS resides, and TTS Director Ann Lewis appeared before the TMF Board, which awarded Login.gov $187 million in September 2021, by far the largest amount in the five years since Congress established the IT modernization “loan” program.",0.05305895209312439,0.13034670054912567,0.8165944218635559,neutral
26,paragraph.27,Sources say GSA officials explained to the board where Login.gov is today and ensured the board knew about the leadership changes for both TTS and Login.,0.2480146884918213,0.13891279697418213,0.6130724549293518,neutral
27,paragraph.28,"“There was clearly concern from high levels of government at the meeting,” one government official said. “But there were no specifics or decisions about whether to stop funding Login. I think there was recognition that it’s a new crew running Login, and they are committed to fixing the problems. It’s clear they are certainly willing to build trust back up.”",0.7692289352416992,0.2307579517364502,0.000013093381312501151,positive
28,paragraph.29,There is another TMF Board meeting scheduled in the coming weeks where Login.gov may come up again.,0.2926780581474304,0.21982377767562866,0.4874982237815857,neutral
29,paragraph.30,GSA says  it informed the TMF Board in February 2022 of the previous mischaracterizations of Login.gov.,0.17273874580860138,0.1341191977262497,0.6931421160697937,neutral
30,paragraph.31,"“Since receiving initial funds from the TMF, Login.gov has briefed the board on at least a quarterly basis, providing detailed updates and sharing regular progress on how funds are being used to achieve agreed-upon milestones – related to preventing fraud, launching in-person proofing, providing better customer service, etc. – in improving Login.gov,” a GSA official said.",0.998782217502594,0.0010686080204322934,0.00014915909559931606,positive
31,paragraph.32,"Sources also say the CIO and Chief Information Security Officer (CISO) councils are scheduled to meet as well in April, and Login’s problems are expected to be on the agenda.",0.7350820899009705,0.16346371173858643,0.1014542356133461,positive
32,paragraph.33,"“Trust in TTS, in Login and in GSA has been frayed. What else about their services — whether building security or procurement that we use — have they been less than transparent about?” said another federal technology official. “I think a lot of us will demand more evidence and transparency about how they are doing business.”",0.5987300872802734,0.40031442046165466,0.0009554667049087584,positive
33,paragraph.34,"Clare Martorana, the federal CIO and chairwoman of the TMF Board, said rebuilding the trust in TTS and Login will be important. But she said she has full confidence in the platform.",0.9980675578117371,0.0007352185202762485,0.0011972542852163315,positive
34,paragraph.35,"“It is recoverable. Our expectations are that every single project and program that we run operates with integrity and accountability and transparency. I think that the GSA leadership team has really proven that, but it is a ding, and it does cause pause,” Martorana said in an interview with Federal News Network. “We as a board are fully interrogating the process that we went through for the investment, making sure that we are going back and looking at the milestones that we were managing to in all of our delivery, to make sure that we’re doing our job, because we are the stewards of the taxpayer dollar, as well as the agencies that get TMF funding. We take this all very seriously, and are having really rigorous conversations, both amongst the board itself, with our TMF program management office colleagues, and with our Login colleagues, because this is something that we’re going to have to build back from as a shared service provider. I have all the confidence in the world that we will be able to recover from this and that our investment has been meaningful for the American people.”",0.9999721050262451,0.000027860609407071024,1.3334227819128408e-11,positive
35,paragraph.36,"The board has allocated $44 million of the $187 million to Login.gov, according to the TMF website.",0.049686405807733536,0.10082995146512985,0.8494836091995239,neutral
36,paragraph.37,Source: Technology Modernization Fund website.,0.33768510818481445,0.3402118682861328,0.32210296392440796,negative
37,paragraph.38,"Hashmi said in an email to Federal News Network that GSA has used the funding to launch an in-person proofing pilot to support identity verification for some users at 18,000 Postal Service locations.",0.8520181179046631,0.10089484602212906,0.04708708077669144,positive
38,paragraph.39,"“Earning and maintaining the trust of our customers, stakeholders, and the public is our highest priority, and that commitment is embedded throughout our Technology Transformation Services programs and initiatives,” Hashmi said. “That is reflected in our management response to the IG report on Login.gov, which outlines how, over the last year, we have taken significant actions to strengthen oversight and implement additional management controls to ensure accountability at Login.gov and throughout TTS. Moving forward, I am committed to fully implementing all of the IG’s recommendations and taking further steps to enable TTS to more effectively deliver accessible, secure and privacy-protecting solutions to our customers and the American public.”",0.9744550585746765,0.025544991716742516,6.51264181472655e-11,positive
39,paragraph.40,Tepid support for TMF investment,0.7223258018493652,0.07400935143232346,0.20366482436656952,positive
40,paragraph.41,Sources say the TMF Board was hesitant to fund Login.gov from its initial proposal.,0.025206569582223892,0.11537079513072968,0.8594226837158203,neutral
41,paragraph.42,"Multiple sources say the board felt pressure to approve the investment, despite obvious shortcomings in its proposal.",0.6597490906715393,0.11546710878610611,0.22478380799293518,positive
42,paragraph.43,"“The level of detail we saw in every other TMF proposal wasn’t there, and the confidence in the TTS team and GSA was a factor in the doubts raised by the board,” said one source. “Even if one person formally shot it down, there were others on the fence or had hesitation that they didn’t have the right team in place to be successful. There was concern that they couldn’t execute on their plan.”",0.22076912224292755,0.7783771753311157,0.0008536245441064239,negative
43,paragraph.44,"Another source said there was some who wanted to split the award to Login into smaller amounts, with milestones along the way to earn more funding.",0.5498510599136353,0.12427566945552826,0.3258732259273529,positive
44,paragraph.45,"“It was just too big of an award,” the second source said. “But there was an immense surge of money coming in, new people on the TMF Board and this was one of 50-70 proposals that the board looked at over a couple of months. There was a lot of interest to get Login funding.”",0.4596545100212097,0.5316895842552185,0.008655894547700882,negative
45,paragraph.46,The first source said there definitely was fear of a “backlash” if the board voted down the project.,0.05809265747666359,0.9082838296890259,0.03362352028489113,negative
46,paragraph.47,"“The board approved it, and like every other project, TTS should have come in every quarter for a deep dive on its progress to show progress,” said the first source. “Every investment has to provide updates, but TTS had a shorter timeline on it and more guardrails for oversight. It’s unclear if the board ended up keeping TTS on a short leash.”",0.9161120653152466,0.08379785716533661,0.00009014015813590959,positive
47,paragraph.48,"While the TMF Board hasn’t decided how it will turn up the scrutiny on Login.gov, sources say they should demand more transparency and demonstrate what the funding is going toward.",0.10405950993299484,0.789402425289154,0.10653810203075409,negative
48,paragraph.49,"“If I were on the board, I would want appropriate levels of detail and not a sales pitch. The board is responsible for investment oversight and to ensure the project is spending its money wisely, addressing risks, and meeting its milestones,” said the first source.",0.9517238140106201,0.047424688935279846,0.0008514220826327801,positive
49,paragraph.50,House lawmakers to grill GSA,0.5664180517196655,0.07585235685110092,0.35772955417633057,positive
50,paragraph.51,Hashmi will get to explain in much more detail in stop two of the apology tour. He will be among one of three featured witnesses at the House subcommittee hearing on Wednesday.,0.07891132682561874,0.7124115228652954,0.20867714285850525,negative
51,paragraph.52,Sonny Hashmi is the commissioner of the Federal Acquisition Service at GSA.,0.2834377884864807,0.0918256863951683,0.6247366070747375,neutral
52,paragraph.53,"Hashmi is scheduled to be joined by GSA Inspector General Carol Ochoa and Jim St. Pierre, the acting director of NIST’s Information Technology Laboratory.",0.028988661244511604,0.10149616003036499,0.8695152401924133,neutral
53,paragraph.54,"The subcommittee will focus on determining why GSA leaders did not exercise adequate oversight of TTS and the services it provides, and examine whether Login.gov should remain a central component of the Biden administration’s anti-fraud efforts until it complied with all required standards.",0.17046596109867096,0.8272154927253723,0.0023185675963759422,negative
54,paragraph.55,"“GSA exists so that agencies can focus on their mission-critical [responsibilities] and not have to worry about services like Login.gov falling short of their promised goal. This wasn’t just a mistake on their part, it was a longstanding misrepresentation, so this hits on the trust front in multiple ways,” said a spokesperson for the committee in an email to Federal News Network.",0.04816678911447525,0.9518303275108337,0.0000029526688649639254,negative
55,paragraph.56,The Senate Homeland Security and Governmental Affairs Committee also is paying attention to Login’s problems.,0.5122094750404358,0.08145000040531158,0.40634050965309143,positive
56,paragraph.57,"An aide for Sen. Gary Peters (D-Mich.), chairman of the committee, said Peters recently spoke with GSA Administrator Robin Carnahan about what the agency is doing to resolve the issues with Login.gov.",0.7974276542663574,0.0045531634241342545,0.19801920652389526,positive
57,paragraph.58,"“Chairman Peters will continue conducting oversight and work to identify potential reforms to improve accountability and transparency of Login.gov, as well as build trust in this important program,” the aide said.",0.9010536074638367,0.09855452924966812,0.00039182050386443734,positive
58,paragraph.59,New RFI for next generation services,0.11349981278181076,0.05334463343024254,0.8331555128097534,neutral
59,paragraph.60,Another step to rebuild that trust is coming through the acquisition process.,0.792643129825592,0.052211835980415344,0.1551450788974762,positive
60,paragraph.61,"TTS just released a new request for information for Login.gov’s next-generation identity proofing solutions. The goal of the RFI is to get feedback from industry and other experts for how Login can provide secure, simple and equitable identity proofing services. This includes more than 100 mandatory requirements across nine functional categories.",0.9816685318946838,0.00032587620080448687,0.01800556480884552,positive
61,paragraph.62,GSA plans to create a multiple award blanket purchase agreement that runs on top of the schedules contract.,0.9883559942245483,0.010199776850640774,0.001444198889657855,positive
62,paragraph.63,Responses to the RFI are due April 7.,0.1757407933473587,0.057646140456199646,0.7666130661964417,neutral
63,paragraph.64,"The concept of Login hasn’t been popular among vendors since it began in 2017, with many seeing it as direct and, to some, unfair competition with the private sector.",0.7096328139305115,0.2602711319923401,0.03009606897830963,positive
64,paragraph.65,"Blake Hall, the CEO of ID.me, one of the most vocal critics of Login.gov, said competition and choice is an important aspect of the identity and access management effort across government.",0.7070335745811462,0.29228466749191284,0.0006817964022047818,positive
65,paragraph.66,"“ID.me has long been committed to a future where consumers, not data brokers or government agencies, have control of their own data online. We are confident our pass rates and equity metrics significantly exceed rates provided by data brokers operating at a similar level of security. Government agencies need transparency around performance metrics to evaluate solutions through the lens of security and accessibility,” Hall wrote in an email to Federal News Network. “At the same time, all cloud service providers should be independently audited and certified against NIST assurance levels. This is already the case for private sector developed solutions. Public-sector solutions should adhere to oversight as well to ensure a level playing field.”",0.9999997615814209,1.7991882828027883e-7,1.3079568894971971e-12,positive
66,paragraph.67,ID.me isn’t without its own challenges. The IRS pulled back on its use of the commercial service after evidence emerged that ID.me’s facial recognition identity proofing service wasn’t at a high enough quality.,0.5090655088424683,0.3598540723323822,0.13108040392398834,positive
67,paragraph.68,"This shows the challenges faced by Login.gov in doing advanced identity proofing aren’t confined to the government. But it’s also why the false assertions left so many frustrated, because it was a well-known problem across government and industry that the NIST standards were difficult to meet.",0.22995054721832275,0.7699151039123535,0.0001342493196716532,negative
68,paragraph.69,"This is why, as another industry executive, who requested anonymity, said, it doesn’t make sense for GSA to keep pushing Login.gov as a government-off-the-shelf platform.",0.21135541796684265,0.4497871696949005,0.3388574421405792,negative
69,paragraph.70,"The executive said GSA’s underlying technology can’t be as agile as industry, no matter how much money they get from TMF or Congress.",0.020271215587854385,0.9528996348381042,0.026829155161976814,negative
70,paragraph.71,"“Login just can’t evolve fast enough and scale quickly enough to handle the needs of the agencies,” the executive said. “Industry is incentivized to do the right thing because there are replacements out there if a customer doesn’t like the services we are providing. But if Login doesn’t do right thing, what’s the incentive to change or fix?”",0.71988844871521,0.25600260496139526,0.024108918383717537,positive
71,paragraph.72,Support for Login.gov concept remains strong,0.9166211485862732,0.026112517341971397,0.057266317307949066,positive
72,paragraph.73,The executive added the consistent feedback they received from government about Login has been that it’s too expensive and the customer service is lacking.,0.0898975133895874,0.030741911381483078,0.879360556602478,neutral
73,paragraph.74,"Federal executives agree that the price and services from Login has been a tough pill to swallow for some time. However, almost every executive talked to for this article agreed that there is a need for a Login.gov-type of platform. One that provides basic identity account management through username, passwords and multi-factor authentication.",0.7873253226280212,0.2110283225774765,0.0016463338397443295,positive
74,paragraph.75,"“Login has gotten a lot better over the years. What they are doing now is quite good. It’s nice to have a single point from customer experience perspective too,” said another federal technology executive. “I think it should stop short of going beyond what it is today, however. It shouldn’t go into identity proofing space. It should strike a balance with private sector, possibly using them for Level 2 and Level 3 proofing, as industry will solve the identity problem faster than the government will. GSA already solved the account problem.”",0.8138135075569153,0.18616989254951477,0.00001662145950831473,positive
75,paragraph.76,Several other CIOs and federal technology executives said they were happy with the service they were getting at the basic levels from Login.,0.7158204913139343,0.07308979332447052,0.21108968555927277,positive
76,paragraph.77,"“I’m a strong supporter of a single governmentwide identity management solution instead of having every agency making citizens go through multiple vendors or systems,” said one agency CIO. “We have been happy with Login and are happy to outsource these type of services rather than build our own.”",0.999846339225769,0.00014326479868032038,0.000010391258911113255,positive
