,text_id,text,positive,negative,neutral,label
77,paragraph.78,"Another CIO offered similar comments, but said they knew Login oversold their capabilities, especially around identity proofing.",0.2070600539445877,0.03157714381814003,0.7613627314567566,neutral
78,paragraph.79,"Though some reports have said the White House is considering through an executive order on managing digital identities, federal executives cautioned against mandating the use of Login .",0.053051531314849854,0.10895523428916931,0.8379932045936584,neutral
79,paragraph.80,"“Managing the identity piece makes more sense for agencies to own and implement. That way they can do threat hunting and other security pieces over top of it, and we are better set up for those efforts,” said a federal technology executive. “But where you have federal agencies who do not have the necessary technical capabilities to manage identities, maybe give them the option in future to use an offering from GSA and Login, but they need to stop short of a mandate.”",0.9334109425544739,0.06536093354225159,0.001228062785230577,positive
80,paragraph.81,How GSA can rebuild the customers’ trust?,0.43771687150001526,0.0639457255601883,0.49833738803863525,neutral
81,paragraph.82,"Mandate or not from the White House, it’s clear that federal executives will not turn away from Login anytime soon. But GSA’s bigger challenge is can they reel in TTS and fix its reputation? Or is the third IG report in six years the final nail in the organization’s reputational coffin?",0.8141223192214966,0.010085289366543293,0.17579248547554016,positive
82,paragraph.83,"Several former and current federal executives said if GSA is serious about changing TTS, it has to start at the top, with Carnahan taking the lead. The concern, of course, is she comes from that culture, having run 18F’s state and local group previously.",0.6889075040817261,0.29944708943367004,0.01164547074586153,positive
83,paragraph.84,The executives give high marks to Hashmi and expressed sympathy for him inheriting the mess.,0.07482677698135376,0.47265440225601196,0.4525188207626343,negative
84,paragraph.85,"“What got me was systematic breakdown across GSA among several offices — FAS, CIO, TTS. That to me led the question of who is actually managing GSA these days, and if they knew what this program office, which was never revenue-neutral, was doing and what are they hoping to accomplish?” said one federal technology executive. “GSA or others have to ask why is [the] TTS head a political appointee? I’m not sure anyone knows why that is the case. If you are trying to run this as a governmentwide service, do you really want politicals in the middle of this? Or would it better to be seen as a good government program and insulated from political pressures?”",0.8956323266029358,0.10436756908893585,6.536846797189355e-8,positive
85,paragraph.86,Another federal executive said the Office of Management and Budget should consider pulling Login out of TTS and GSA altogether. Maybe even make it part of OMB or its own standalone program.,0.8114357590675354,0.10035630315542221,0.08820790797472,positive
86,paragraph.87,"“That is not the model usually done, but the amount of trust agencies will hand off to Login, you don’t want 14 levels of leadership between you and accountability of the program like it is now,” the executive said. “You are talking about a tool leveraged by the vast majority of American people, so I think the administration needs to create such scrutiny and accountability around it that they will ensure they deliver on their promise.”",0.9991981387138367,0.0008018753724172711,3.576709417529855e-8,positive
87,paragraph.88,"A promise that is well supported, but a trust that has been broken.",0.9332030415534973,0.0596369132399559,0.0071600815281271935,positive
